{"comparison_contract":"conway_recursive_order_v1","domain":"formal_domain:finite_normal_play_short_games:v0","literal_game":{"left":[],"right":[]},"name":"zero","schema_version":"partizan.fixed_value_target.v0.1","target_id":"fixed-target-sha256:6d29c7c806cf995735b85716cfceb3007e9bb10ee7539a2f29f57985fefaa71f"}
